{"analysis":{"cacheSaving":22.1,"findings":[{"monthlySaving":30.25,"occurrences":3,"ruleId":"wordy-phrases","severity":"low","tokensSaved":100}],"inputTokens":1200,"modelId":"gpt-5","monthlyAfterRewrite":390.25,"monthlyNow":420.5,"optimizedTokens":900,"promptTokens":1000,"toolTokens":200},"catalogue":{"currency":"USD","engineVersion":"0.1.0","modelCatalogueDate":"2026-08-10","rulesetId":"savedyouatoken-rules-2026-08-13","tokenizer":{"accuracy":"exact","counter":"o200k_base","family":"o200k_base"}},"contract":{"kind":"report","version":{"major":1,"minor":1}},"maturity":{"observations":42,"state":"mature"},"provenance":{"generatedAt":"2026-08-13T13:00:00.000Z","producer":"@savedyouatoken/sdk","producerVersion":"0.1.0"},"release":{"deployedAt":"2026-08-13T12:00:00.000Z","id":"abc123"},"window":{"endedAt":"2026-08-13T13:00:00.000Z","requests":42,"startedAt":"2026-08-13T12:00:00.000Z"},"workflow":{"environment":"production","id":"support/triage"},"workload":{"batch":false,"cacheHitRate":0.4,"cacheTtl":"5m","outputTokens":350,"requestsPerDay":20000}}
